{
  "id": "sample-id",
  "collection_id": "sample-collection_id",
  "project_id": "sample-project_id",
  "app_user_id": "sample-app_user_id",
  "created_by": "sample-created_by",
  "created_at": "2026-05-29T14:30:00Z",
  "updated_at": "2026-05-29T14:30:00Z",
  "deleted_at": "2026-05-29T14:30:00Z",
  "data": {}
}